{
  "tableTitle": "我的年代作品 Bingo",
  "subtitle": "点亮你看过或玩过的作品",
  "columnHeaders": ["时期 / 类型", "动画", "漫画", "游戏"],
  "rowHeaders": ["小学以前", "小学", "初中", "高中", "大学以后"],
  "cells": {
    "0:1": "看过一部经典动画",
    "0:2": "读过一套长篇漫画",
    "0:3": "第一次通关游戏",
    "1:1": "追过电视台连载",
    "1:2": "和同学交换漫画",
    "1:3": "在假期沉迷一款游戏"
  }
}
